{
  "mode": "full_pipeline",
  "timestamp": "2026-05-11T08:45:50.556100",
  "plasmid_filter": null,
  "comparisons": [
    {
      "plasmid_accession": "CP012955.1",
      "matched_pairs": [],
      "missed_references": [
        {
          "plasmid_accession": "CP012955.1",
          "pdif_start": 4097,
          "pdif_end": 4124,
          "pdif_sequence": "ATTTAACATAATGGATATTATACGAAGT",
          "strand": "+",
          "orientation": "",
          "source_pmid": "36426893",
          "source_description": "Shao C, Chen Y, Zhao Y, Wang Y, Song H, He M, Chen W, Xie Z, Qin S, Hua X. PdifFinder: a tool for identifying plasmid-borne dif sites and their cognate recombinases. Brief Bioinform. 2023;24(1):bbac521. DOI: 10.1093/bib/bbac521.",
          "curator_notes": "Located via exact string match of pdif seed sequence (from redundant.seed.fa) in cached plasmid sequence. This pdif site is present in the pdifFinder seed database as accession CP012955.1.",
          "curation_date": "2026-05-10"
        }
      ],
      "unvalidated_detections": [],
      "failure_categories": {}
    },
    {
      "plasmid_accession": "CP012955.1",
      "matched_pairs": [],
      "missed_references": [
        {
          "plasmid_accession": "CP012955.1",
          "pdif_start": 6135,
          "pdif_end": 6162,
          "pdif_sequence": "ATTTAACATAAGGGCTGTTATACGAAAT",
          "strand": "+",
          "orientation": "",
          "source_pmid": "36426893",
          "source_description": "Shao C, Chen Y, Zhao Y, Wang Y, Song H, He M, Chen W, Xie Z, Qin S, Hua X. PdifFinder: a tool for identifying plasmid-borne dif sites and their cognate recombinases. Brief Bioinform. 2023;24(1):bbac521. DOI: 10.1093/bib/bbac521.",
          "curator_notes": "Located via exact string match of pdif seed sequence (from redundant.seed.fa) in cached plasmid sequence. This pdif site is present in the pdifFinder seed database as accession CP012955.1.",
          "curation_date": "2026-05-10"
        }
      ],
      "unvalidated_detections": [],
      "failure_categories": {}
    },
    {
      "plasmid_accession": "CP012955.1",
      "matched_pairs": [],
      "missed_references": [
        {
          "plasmid_accession": "CP012955.1",
          "pdif_start": 7625,
          "pdif_end": 7652,
          "pdif_sequence": "ATTTAACATAAAAACTCTTATACGAAGC",
          "strand": "+",
          "orientation": "",
          "source_pmid": "36426893",
          "source_description": "Shao C, Chen Y, Zhao Y, Wang Y, Song H, He M, Chen W, Xie Z, Qin S, Hua X. PdifFinder: a tool for identifying plasmid-borne dif sites and their cognate recombinases. Brief Bioinform. 2023;24(1):bbac521. DOI: 10.1093/bib/bbac521.",
          "curator_notes": "Located via exact string match of pdif seed sequence (from redundant.seed.fa) in cached plasmid sequence. This pdif site is present in the pdifFinder seed database as accession CP012955.1.",
          "curation_date": "2026-05-10"
        }
      ],
      "unvalidated_detections": [],
      "failure_categories": {}
    },
    {
      "plasmid_accession": "CP012956.1",
      "matched_pairs": [
        {
          "ref_index": 0,
          "det_index": 0,
          "ref_start": 29409,
          "ref_end": 29436,
          "det_start": 29409,
          "det_end": 29436
        }
      ],
      "missed_references": [],
      "unvalidated_detections": [
        {
          "det_index": 1
        }
      ],
      "failure_categories": {}
    },
    {
      "plasmid_accession": "CP012956.1",
      "matched_pairs": [
        {
          "ref_index": 0,
          "det_index": 1,
          "ref_start": 31747,
          "ref_end": 31774,
          "det_start": 31747,
          "det_end": 31774
        }
      ],
      "missed_references": [],
      "unvalidated_detections": [
        {
          "det_index": 0
        }
      ],
      "failure_categories": {}
    },
    {
      "plasmid_accession": "CP012956.1",
      "matched_pairs": [],
      "missed_references": [
        {
          "plasmid_accession": "CP012956.1",
          "pdif_start": 32347,
          "pdif_end": 32374,
          "pdif_sequence": "AATTAACATAATAAACGTTATATGAACT",
          "strand": "+",
          "orientation": "",
          "source_pmid": "36426893",
          "source_description": "Shao C, Chen Y, Zhao Y, Wang Y, Song H, He M, Chen W, Xie Z, Qin S, Hua X. PdifFinder: a tool for identifying plasmid-borne dif sites and their cognate recombinases. Brief Bioinform. 2023;24(1):bbac521. DOI: 10.1093/bib/bbac521.",
          "curator_notes": "Located via exact string match of pdif seed sequence (from redundant.seed.fa) in cached plasmid sequence. This pdif site is present in the pdifFinder seed database as accession CP012956.1.",
          "curation_date": "2026-05-10"
        }
      ],
      "unvalidated_detections": [
        {
          "det_index": 0
        },
        {
          "det_index": 1
        }
      ],
      "failure_categories": {}
    },
    {
      "plasmid_accession": "CP024419.1",
      "matched_pairs": [
        {
          "ref_index": 0,
          "det_index": 3,
          "ref_start": 9070,
          "ref_end": 9097,
          "det_start": 9070,
          "det_end": 9097
        }
      ],
      "missed_references": [],
      "unvalidated_detections": [
        {
          "det_index": 0
        },
        {
          "det_index": 1
        },
        {
          "det_index": 2
        },
        {
          "det_index": 4
        },
        {
          "det_index": 5
        },
        {
          "det_index": 6
        },
        {
          "det_index": 7
        }
      ],
      "failure_categories": {}
    },
    {
      "plasmid_accession": "CP024419.1",
      "matched_pairs": [
        {
          "ref_index": 0,
          "det_index": 4,
          "ref_start": 23706,
          "ref_end": 23733,
          "det_start": 23706,
          "det_end": 23733
        }
      ],
      "missed_references": [],
      "unvalidated_detections": [
        {
          "det_index": 0
        },
        {
          "det_index": 1
        },
        {
          "det_index": 2
        },
        {
          "det_index": 3
        },
        {
          "det_index": 5
        },
        {
          "det_index": 6
        },
        {
          "det_index": 7
        }
      ],
      "failure_categories": {}
    },
    {
      "plasmid_accession": "CP041590.1",
      "matched_pairs": [
        {
          "ref_index": 0,
          "det_index": 0,
          "ref_start": 82712,
          "ref_end": 82739,
          "det_start": 82712,
          "det_end": 82739
        }
      ],
      "missed_references": [],
      "unvalidated_detections": [
        {
          "det_index": 1
        },
        {
          "det_index": 2
        },
        {
          "det_index": 3
        },
        {
          "det_index": 4
        },
        {
          "det_index": 5
        }
      ],
      "failure_categories": {}
    },
    {
      "plasmid_accession": "CP041590.1",
      "matched_pairs": [
        {
          "ref_index": 0,
          "det_index": 2,
          "ref_start": 91943,
          "ref_end": 91970,
          "det_start": 91943,
          "det_end": 91970
        }
      ],
      "missed_references": [],
      "unvalidated_detections": [
        {
          "det_index": 0
        },
        {
          "det_index": 1
        },
        {
          "det_index": 3
        },
        {
          "det_index": 4
        },
        {
          "det_index": 5
        }
      ],
      "failure_categories": {}
    },
    {
      "plasmid_accession": "CP041590.1",
      "matched_pairs": [
        {
          "ref_index": 0,
          "det_index": 3,
          "ref_start": 92585,
          "ref_end": 92612,
          "det_start": 92585,
          "det_end": 92612
        }
      ],
      "missed_references": [],
      "unvalidated_detections": [
        {
          "det_index": 0
        },
        {
          "det_index": 1
        },
        {
          "det_index": 2
        },
        {
          "det_index": 4
        },
        {
          "det_index": 5
        }
      ],
      "failure_categories": {}
    },
    {
      "plasmid_accession": "CP045108.1",
      "matched_pairs": [],
      "missed_references": [
        {
          "plasmid_accession": "CP045108.1",
          "pdif_start": 4973,
          "pdif_end": 5000,
          "pdif_sequence": "CTTTAACATAAAATCTCTTATGAGAATT",
          "strand": "+",
          "orientation": "",
          "source_pmid": "36426893",
          "source_description": "Shao C, Chen Y, Zhao Y, Wang Y, Song H, He M, Chen W, Xie Z, Qin S, Hua X. PdifFinder: a tool for identifying plasmid-borne dif sites and their cognate recombinases. Brief Bioinform. 2023;24(1):bbac521. DOI: 10.1093/bib/bbac521.",
          "curator_notes": "Located via exact string match of pdif seed sequence (from redundant.seed.fa) in cached plasmid sequence. This pdif site is present in the pdifFinder seed database as accession CP045108.1.",
          "curation_date": "2026-05-10"
        }
      ],
      "unvalidated_detections": [],
      "failure_categories": {}
    },
    {
      "plasmid_accession": "CP045109.1",
      "matched_pairs": [],
      "missed_references": [
        {
          "plasmid_accession": "CP045109.1",
          "pdif_start": 5226,
          "pdif_end": 5253,
          "pdif_sequence": "ATTTCATATAACGCCCATTATGTTAAAT",
          "strand": "+",
          "orientation": "",
          "source_pmid": "36426893",
          "source_description": "Shao C, Chen Y, Zhao Y, Wang Y, Song H, He M, Chen W, Xie Z, Qin S, Hua X. PdifFinder: a tool for identifying plasmid-borne dif sites and their cognate recombinases. Brief Bioinform. 2023;24(1):bbac521. DOI: 10.1093/bib/bbac521.",